

================================================================
== Vivado HLS Report for 'calcDistancesHW'
================================================================
* Date:           Sun Nov 30 19:31:01 2025

* Version:        2016.4 (Build 1722992 on Wed Mar 08 18:30:27 MST 2017)
* Project:        calcDistancesHW
* Solution:       solution
* Product family: zynq
* Target device:  xc7z010clg400-2


================================================================
== Performance Estimates
================================================================
+ Timing (ns): 
    * Summary: 
    +--------+-------+----------+------------+
    |  Clock | Target| Estimated| Uncertainty|
    +--------+-------+----------+------------+
    |ap_clk  |  10.00|      8.68|        1.25|
    +--------+-------+----------+------------+

+ Latency (clock cycles): 
    * Summary: 
    +--------+--------+--------+--------+---------+
    |     Latency     |     Interval    | Pipeline|
    |   min  |   max  |   min  |   max  |   Type  |
    +--------+--------+--------+--------+---------+
    |  475204|  475204|  475205|  475205|   none  |
    +--------+--------+--------+--------+---------+

    + Detail: 
        * Instance: 
        N/A

        * Loop: 
        +-----------------------+--------+--------+----------+-----------+-----------+------+----------+
        |                       |     Latency     | Iteration|  Initiation Interval  | Trip |          |
        |       Loop Name       |   min  |   max  |  Latency |  achieved |   target  | Count| Pipelined|
        +-----------------------+--------+--------+----------+-----------+-----------+------+----------+
        |- LOAD_DATA_HW_TMP     |   34816|   34816|        34|          -|          -|  1024|    no    |
        | + LOAD_DATA_HW_TMP.1  |      32|      32|         1|          -|          -|    32|    no    |
        |- LOAD_MOVIE_TMP       |      64|      64|         2|          -|          -|    32|    no    |
        |- COMPUTE_DISTS        |  438272|  438272|       428|          -|          -|  1024|    no    |
        | + COMPUTE_DISTS.1     |     416|     416|        13|          -|          -|    32|    no    |
        |- WRITE_DISTS          |    2048|    2048|         2|          -|          -|  1024|    no    |
        +-----------------------+--------+--------+----------+-----------+-----------+------+----------+

============================================================
+ Verbose Summary: Synthesis Manager
============================================================
InlineROM: 1
ExposeGlobal: 0
============================================================
+ Verbose Summary: CDFG Model
============================================================
IsTopModel: 1
ResetActiveHigh: 1
IsCombinational: 0
IsDatapathOnly: 0
HasWiredReturn: 1
HasMFsm: 0
HasVarLatency: 1
IsPipeline: 0
IsRtlPipelined: 0
IsInstanceOverlapped: 0
IsDontTouch: 0
HasImplIP: 0
IsGatedGlobalClock: 0


============================================================
+ Verbose Summary: Schedule
============================================================
* Number of FSM states: 31
* Pipeline: 0
* Dataflow Pipeline: 0

* FSM state transitions: 
1 --> 
	2  / true
2 --> 
	3  / (!exitcond5)
	4  / (exitcond5)
3 --> 
	3  / (!exitcond4)
	2  / (exitcond4)
4 --> 
	5  / (!exitcond3)
	6  / (exitcond3)
5 --> 
	4  / true
6 --> 
	7  / (!exitcond2)
	30  / (exitcond2)
7 --> 
	8  / (!exitcond1)
	20  / (exitcond1)
8 --> 
	9  / true
9 --> 
	10  / true
10 --> 
	11  / true
11 --> 
	12  / true
12 --> 
	13  / true
13 --> 
	14  / true
14 --> 
	15  / true
15 --> 
	16  / true
16 --> 
	17  / true
17 --> 
	18  / true
18 --> 
	19  / true
19 --> 
	7  / true
20 --> 
	21  / true
21 --> 
	22  / true
22 --> 
	23  / true
23 --> 
	24  / true
24 --> 
	25  / true
25 --> 
	26  / true
26 --> 
	27  / true
27 --> 
	28  / true
28 --> 
	29  / true
29 --> 
	6  / true
30 --> 
	31  / (!exitcond)
31 --> 
	30  / true
* FSM state operations: 

 <State 1>: 1.31ns
ST_1: StgValue_32 (3)  [1/1] 0.00ns
:0  call void (...)* @_ssdm_op_SpecBitsMap(float* %data_hw) nounwind, !map !7

ST_1: StgValue_33 (4)  [1/1] 0.00ns
:1  call void (...)* @_ssdm_op_SpecBitsMap(float* %dists_hw) nounwind, !map !13

ST_1: StgValue_34 (5)  [1/1] 0.00ns
:2  call void (...)* @_ssdm_op_SpecTopModule([16 x i8]* @calcDistancesHW_str) nounwind

ST_1: data_hw_tmp (6)  [1/1] 0.00ns  loc: /home/sdsocuser/workspace/test/src/calcDist.cpp:7
:3  %data_hw_tmp = alloca [32768 x float], align 4

ST_1: movie_tmp (7)  [1/1] 0.00ns  loc: /home/sdsocuser/workspace/test/src/calcDist.cpp:8
:4  %movie_tmp = alloca [32 x float], align 4

ST_1: dists_hw_tmp (8)  [1/1] 0.00ns  loc: /home/sdsocuser/workspace/test/src/calcDist.cpp:9
:5  %dists_hw_tmp = alloca [1024 x float], align 4

ST_1: StgValue_38 (9)  [1/1] 0.00ns  loc: /home/sdsocuser/workspace/test/src/calcDist.cpp:7
:6  call void (...)* @_ssdm_op_SpecLatency(i32 1, i32 65535, [1 x i8]* @p_str) nounwind

ST_1: StgValue_39 (10)  [1/1] 0.00ns  loc: /home/sdsocuser/workspace/test/src/calcDist.cpp:7
:7  call void (...)* @_ssdm_op_SpecInterface(float* %data_hw, [8 x i8]* @p_str1, i32 0, i32 0, [1 x i8]* @p_str, i32 0, i32 0, [1 x i8]* @p_str, [1 x i8]* @p_str, [1 x i8]* @p_str, i32 0, i32 0, i32 0, i32 0, [1 x i8]* @p_str, [1 x i8]* @p_str) nounwind

ST_1: StgValue_40 (11)  [1/1] 0.00ns  loc: /home/sdsocuser/workspace/test/src/calcDist.cpp:7
:8  call void (...)* @_ssdm_op_SpecInterface(float* %dists_hw, [8 x i8]* @p_str1, i32 0, i32 0, [1 x i8]* @p_str, i32 0, i32 0, [1 x i8]* @p_str, [1 x i8]* @p_str, [1 x i8]* @p_str, i32 0, i32 0, i32 0, i32 0, [1 x i8]* @p_str, [1 x i8]* @p_str) nounwind

ST_1: StgValue_41 (12)  [1/1] 1.31ns  loc: /home/sdsocuser/workspace/test/src/calcDist.cpp:12
:9  br label %1


 <State 2>: 1.72ns
ST_2: i (14)  [1/1] 0.00ns
:0  %i = phi i11 [ 0, %0 ], [ %i_2, %5 ]

ST_2: tmp_4 (15)  [1/1] 0.00ns  loc: /home/sdsocuser/workspace/test/src/calcDist.cpp:12
:1  %tmp_4 = call i16 @_ssdm_op_BitConcatenate.i16.i11.i5(i11 %i, i5 0)

ST_2: tmp_5_cast (16)  [1/1] 0.00ns  loc: /home/sdsocuser/workspace/test/src/calcDist.cpp:12
:2  %tmp_5_cast = zext i16 %tmp_4 to i17

ST_2: exitcond5 (17)  [1/1] 1.72ns  loc: /home/sdsocuser/workspace/test/src/calcDist.cpp:12
:3  %exitcond5 = icmp eq i11 %i, -1024

ST_2: empty (18)  [1/1] 0.00ns
:4  %empty = call i32 (...)* @_ssdm_op_SpecLoopTripCount(i64 1024, i64 1024, i64 1024) nounwind

ST_2: i_2 (19)  [1/1] 1.50ns  loc: /home/sdsocuser/workspace/test/src/calcDist.cpp:12
:5  %i_2 = add i11 %i, 1

ST_2: StgValue_48 (20)  [1/1] 0.00ns  loc: /home/sdsocuser/workspace/test/src/calcDist.cpp:12
:6  br i1 %exitcond5, label %.preheader7.preheader, label %2

ST_2: StgValue_49 (22)  [1/1] 0.00ns  loc: /home/sdsocuser/workspace/test/src/calcDist.cpp:12
:0  call void (...)* @_ssdm_op_SpecLoopName([17 x i8]* @p_str2) nounwind

ST_2: tmp_1 (23)  [1/1] 0.00ns  loc: /home/sdsocuser/workspace/test/src/calcDist.cpp:12
:1  %tmp_1 = call i32 (...)* @_ssdm_op_SpecRegionBegin([17 x i8]* @p_str2) nounwind

ST_2: StgValue_51 (24)  [1/1] 1.31ns  loc: /home/sdsocuser/workspace/test/src/calcDist.cpp:13
:2  br label %3

ST_2: StgValue_52 (43)  [1/1] 1.31ns  loc: /home/sdsocuser/workspace/test/src/calcDist.cpp:19
.preheader7.preheader:0  br label %.preheader7


 <State 3>: 6.75ns
ST_3: j (26)  [1/1] 0.00ns
:0  %j = phi i6 [ 0, %2 ], [ %j_1, %4 ]

ST_3: j_cast5_cast (27)  [1/1] 0.00ns  loc: /home/sdsocuser/workspace/test/src/calcDist.cpp:14
:1  %j_cast5_cast = zext i6 %j to i17

ST_3: tmp_8 (28)  [1/1] 1.60ns  loc: /home/sdsocuser/workspace/test/src/calcDist.cpp:14
:2  %tmp_8 = add i17 %tmp_5_cast, %j_cast5_cast

ST_3: tmp_8_cast (29)  [1/1] 0.00ns  loc: /home/sdsocuser/workspace/test/src/calcDist.cpp:14
:3  %tmp_8_cast = zext i17 %tmp_8 to i32

ST_3: data_hw_tmp_addr_1 (30)  [1/1] 0.00ns  loc: /home/sdsocuser/workspace/test/src/calcDist.cpp:14
:4  %data_hw_tmp_addr_1 = getelementptr [32768 x float]* %data_hw_tmp, i32 0, i32 %tmp_8_cast

ST_3: exitcond4 (31)  [1/1] 1.51ns  loc: /home/sdsocuser/workspace/test/src/calcDist.cpp:13
:5  %exitcond4 = icmp eq i6 %j, -32

ST_3: empty_4 (32)  [1/1] 0.00ns
:6  %empty_4 = call i32 (...)* @_ssdm_op_SpecLoopTripCount(i64 32, i64 32, i64 32) nounwind

ST_3: j_1 (33)  [1/1] 1.40ns  loc: /home/sdsocuser/workspace/test/src/calcDist.cpp:13
:7  %j_1 = add i6 %j, 1

ST_3: StgValue_61 (34)  [1/1] 0.00ns  loc: /home/sdsocuser/workspace/test/src/calcDist.cpp:13
:8  br i1 %exitcond4, label %5, label %4

ST_3: data_hw_read (36)  [1/1] 4.38ns  loc: /home/sdsocuser/workspace/test/src/calcDist.cpp:14
:0  %data_hw_read = call float @_ssdm_op_Read.ap_fifo.floatP(float* %data_hw) nounwind

ST_3: StgValue_63 (37)  [1/1] 2.38ns  loc: /home/sdsocuser/workspace/test/src/calcDist.cpp:14
:1  store float %data_hw_read, float* %data_hw_tmp_addr_1, align 4

ST_3: StgValue_64 (38)  [1/1] 0.00ns  loc: /home/sdsocuser/workspace/test/src/calcDist.cpp:13
:2  br label %3

ST_3: empty_5 (40)  [1/1] 0.00ns  loc: /home/sdsocuser/workspace/test/src/calcDist.cpp:16
:0  %empty_5 = call i32 (...)* @_ssdm_op_SpecRegionEnd([17 x i8]* @p_str2, i32 %tmp_1) nounwind

ST_3: StgValue_66 (41)  [1/1] 0.00ns  loc: /home/sdsocuser/workspace/test/src/calcDist.cpp:12
:1  br label %1


 <State 4>: 2.38ns
ST_4: i1 (45)  [1/1] 0.00ns
.preheader7:0  %i1 = phi i6 [ %i_1, %6 ], [ 0, %.preheader7.preheader ]

ST_4: i1_cast4 (46)  [1/1] 0.00ns  loc: /home/sdsocuser/workspace/test/src/calcDist.cpp:19
.preheader7:1  %i1_cast4 = zext i6 %i1 to i32

ST_4: data_hw_tmp_addr (47)  [1/1] 0.00ns  loc: /home/sdsocuser/workspace/test/src/calcDist.cpp:20
.preheader7:2  %data_hw_tmp_addr = getelementptr [32768 x float]* %data_hw_tmp, i32 0, i32 %i1_cast4

ST_4: exitcond3 (48)  [1/1] 1.51ns  loc: /home/sdsocuser/workspace/test/src/calcDist.cpp:19
.preheader7:3  %exitcond3 = icmp eq i6 %i1, -32

ST_4: empty_6 (49)  [1/1] 0.00ns
.preheader7:4  %empty_6 = call i32 (...)* @_ssdm_op_SpecLoopTripCount(i64 32, i64 32, i64 32) nounwind

ST_4: i_1 (50)  [1/1] 1.40ns  loc: /home/sdsocuser/workspace/test/src/calcDist.cpp:19
.preheader7:5  %i_1 = add i6 %i1, 1

ST_4: StgValue_73 (51)  [1/1] 0.00ns  loc: /home/sdsocuser/workspace/test/src/calcDist.cpp:19
.preheader7:6  br i1 %exitcond3, label %.preheader6.preheader, label %6

ST_4: data_hw_tmp_load (54)  [2/2] 2.38ns  loc: /home/sdsocuser/workspace/test/src/calcDist.cpp:20
:1  %data_hw_tmp_load = load float* %data_hw_tmp_addr, align 4

ST_4: StgValue_75 (59)  [1/1] 1.31ns  loc: /home/sdsocuser/workspace/test/src/calcDist.cpp:24
.preheader6.preheader:0  br label %.preheader6


 <State 5>: 4.76ns
ST_5: StgValue_76 (53)  [1/1] 0.00ns  loc: /home/sdsocuser/workspace/test/src/calcDist.cpp:19
:0  call void (...)* @_ssdm_op_SpecLoopName([15 x i8]* @p_str3) nounwind

ST_5: data_hw_tmp_load (54)  [1/2] 2.38ns  loc: /home/sdsocuser/workspace/test/src/calcDist.cpp:20
:1  %data_hw_tmp_load = load float* %data_hw_tmp_addr, align 4

ST_5: movie_tmp_addr (55)  [1/1] 0.00ns  loc: /home/sdsocuser/workspace/test/src/calcDist.cpp:20
:2  %movie_tmp_addr = getelementptr inbounds [32 x float]* %movie_tmp, i32 0, i32 %i1_cast4

ST_5: StgValue_79 (56)  [1/1] 2.38ns  loc: /home/sdsocuser/workspace/test/src/calcDist.cpp:20
:3  store float %data_hw_tmp_load, float* %movie_tmp_addr, align 4

ST_5: StgValue_80 (57)  [1/1] 0.00ns  loc: /home/sdsocuser/workspace/test/src/calcDist.cpp:19
:4  br label %.preheader7


 <State 6>: 1.72ns
ST_6: i2 (61)  [1/1] 0.00ns
.preheader6:0  %i2 = phi i11 [ %i_4, %10 ], [ 0, %.preheader6.preheader ]

ST_6: i2_cast3 (62)  [1/1] 0.00ns  loc: /home/sdsocuser/workspace/test/src/calcDist.cpp:24
.preheader6:1  %i2_cast3 = zext i11 %i2 to i32

ST_6: tmp_s (63)  [1/1] 0.00ns  loc: /home/sdsocuser/workspace/test/src/calcDist.cpp:24
.preheader6:2  %tmp_s = call i16 @_ssdm_op_BitConcatenate.i16.i11.i5(i11 %i2, i5 0)

ST_6: tmp_11_cast (64)  [1/1] 0.00ns  loc: /home/sdsocuser/workspace/test/src/calcDist.cpp:24
.preheader6:3  %tmp_11_cast = zext i16 %tmp_s to i17

ST_6: exitcond2 (65)  [1/1] 1.72ns  loc: /home/sdsocuser/workspace/test/src/calcDist.cpp:24
.preheader6:4  %exitcond2 = icmp eq i11 %i2, -1024

ST_6: empty_7 (66)  [1/1] 0.00ns
.preheader6:5  %empty_7 = call i32 (...)* @_ssdm_op_SpecLoopTripCount(i64 1024, i64 1024, i64 1024) nounwind

ST_6: i_4 (67)  [1/1] 1.50ns  loc: /home/sdsocuser/workspace/test/src/calcDist.cpp:24
.preheader6:6  %i_4 = add i11 %i2, 1

ST_6: StgValue_88 (68)  [1/1] 0.00ns  loc: /home/sdsocuser/workspace/test/src/calcDist.cpp:24
.preheader6:7  br i1 %exitcond2, label %.preheader.preheader, label %7

ST_6: StgValue_89 (70)  [1/1] 0.00ns  loc: /home/sdsocuser/workspace/test/src/calcDist.cpp:24
:0  call void (...)* @_ssdm_op_SpecLoopName([14 x i8]* @p_str4) nounwind

ST_6: tmp_2 (71)  [1/1] 0.00ns  loc: /home/sdsocuser/workspace/test/src/calcDist.cpp:24
:1  %tmp_2 = call i32 (...)* @_ssdm_op_SpecRegionBegin([14 x i8]* @p_str4) nounwind

ST_6: StgValue_91 (72)  [1/1] 1.31ns  loc: /home/sdsocuser/workspace/test/src/calcDist.cpp:26
:2  br label %8

ST_6: StgValue_92 (100)  [1/1] 1.31ns  loc: /home/sdsocuser/workspace/test/src/calcDist.cpp:34
.preheader.preheader:0  br label %.preheader


 <State 7>: 8.68ns
ST_7: sum (74)  [1/1] 0.00ns
:0  %sum = phi float [ 0.000000e+00, %7 ], [ %sum_1, %9 ]

ST_7: j3 (75)  [1/1] 0.00ns
:1  %j3 = phi i6 [ 0, %7 ], [ %j_2, %9 ]

ST_7: j3_cast2 (76)  [1/1] 0.00ns  loc: /home/sdsocuser/workspace/test/src/calcDist.cpp:26
:2  %j3_cast2 = zext i6 %j3 to i32

ST_7: j3_cast2_cast (77)  [1/1] 0.00ns  loc: /home/sdsocuser/workspace/test/src/calcDist.cpp:27
:3  %j3_cast2_cast = zext i6 %j3 to i17

ST_7: tmp_3 (78)  [1/1] 1.60ns  loc: /home/sdsocuser/workspace/test/src/calcDist.cpp:27
:4  %tmp_3 = add i17 %tmp_11_cast, %j3_cast2_cast

ST_7: tmp_12_cast (79)  [1/1] 0.00ns  loc: /home/sdsocuser/workspace/test/src/calcDist.cpp:27
:5  %tmp_12_cast = zext i17 %tmp_3 to i32

ST_7: data_hw_tmp_addr_2 (80)  [1/1] 0.00ns  loc: /home/sdsocuser/workspace/test/src/calcDist.cpp:27
:6  %data_hw_tmp_addr_2 = getelementptr [32768 x float]* %data_hw_tmp, i32 0, i32 %tmp_12_cast

ST_7: exitcond1 (81)  [1/1] 1.51ns  loc: /home/sdsocuser/workspace/test/src/calcDist.cpp:26
:7  %exitcond1 = icmp eq i6 %j3, -32

ST_7: empty_8 (82)  [1/1] 0.00ns
:8  %empty_8 = call i32 (...)* @_ssdm_op_SpecLoopTripCount(i64 32, i64 32, i64 32) nounwind

ST_7: j_2 (83)  [1/1] 1.40ns  loc: /home/sdsocuser/workspace/test/src/calcDist.cpp:26
:9  %j_2 = add i6 %j3, 1

ST_7: StgValue_103 (84)  [1/1] 0.00ns  loc: /home/sdsocuser/workspace/test/src/calcDist.cpp:26
:10  br i1 %exitcond1, label %10, label %9

ST_7: data_hw_tmp_load_1 (86)  [2/2] 2.38ns  loc: /home/sdsocuser/workspace/test/src/calcDist.cpp:27
:0  %data_hw_tmp_load_1 = load float* %data_hw_tmp_addr_2, align 4

ST_7: movie_tmp_addr_1 (87)  [1/1] 0.00ns  loc: /home/sdsocuser/workspace/test/src/calcDist.cpp:27
:1  %movie_tmp_addr_1 = getelementptr inbounds [32 x float]* %movie_tmp, i32 0, i32 %j3_cast2

ST_7: movie_tmp_load (88)  [2/2] 2.38ns  loc: /home/sdsocuser/workspace/test/src/calcDist.cpp:27
:2  %movie_tmp_load = load float* %movie_tmp_addr_1, align 4

ST_7: tmp_6 (94)  [10/10] 8.68ns  loc: /home/sdsocuser/workspace/test/src/calcDist.cpp:30
:0  %tmp_6 = call float @llvm.sqrt.f32(float %sum)


 <State 8>: 2.38ns
ST_8: data_hw_tmp_load_1 (86)  [1/2] 2.38ns  loc: /home/sdsocuser/workspace/test/src/calcDist.cpp:27
:0  %data_hw_tmp_load_1 = load float* %data_hw_tmp_addr_2, align 4

ST_8: movie_tmp_load (88)  [1/2] 2.38ns  loc: /home/sdsocuser/workspace/test/src/calcDist.cpp:27
:2  %movie_tmp_load = load float* %movie_tmp_addr_1, align 4


 <State 9>: 8.59ns
ST_9: diff (89)  [4/4] 8.59ns  loc: /home/sdsocuser/workspace/test/src/calcDist.cpp:27
:3  %diff = fsub float %data_hw_tmp_load_1, %movie_tmp_load


 <State 10>: 8.59ns
ST_10: diff (89)  [3/4] 8.59ns  loc: /home/sdsocuser/workspace/test/src/calcDist.cpp:27
:3  %diff = fsub float %data_hw_tmp_load_1, %movie_tmp_load


 <State 11>: 8.59ns
ST_11: diff (89)  [2/4] 8.59ns  loc: /home/sdsocuser/workspace/test/src/calcDist.cpp:27
:3  %diff = fsub float %data_hw_tmp_load_1, %movie_tmp_load


 <State 12>: 8.59ns
ST_12: diff (89)  [1/4] 8.59ns  loc: /home/sdsocuser/workspace/test/src/calcDist.cpp:27
:3  %diff = fsub float %data_hw_tmp_load_1, %movie_tmp_load


 <State 13>: 8.43ns
ST_13: tmp_9 (90)  [3/3] 8.43ns  loc: /home/sdsocuser/workspace/test/src/calcDist.cpp:28
:4  %tmp_9 = fmul float %diff, %diff


 <State 14>: 8.43ns
ST_14: tmp_9 (90)  [2/3] 8.43ns  loc: /home/sdsocuser/workspace/test/src/calcDist.cpp:28
:4  %tmp_9 = fmul float %diff, %diff


 <State 15>: 8.43ns
ST_15: tmp_9 (90)  [1/3] 8.43ns  loc: /home/sdsocuser/workspace/test/src/calcDist.cpp:28
:4  %tmp_9 = fmul float %diff, %diff


 <State 16>: 8.59ns
ST_16: sum_1 (91)  [4/4] 8.59ns  loc: /home/sdsocuser/workspace/test/src/calcDist.cpp:28
:5  %sum_1 = fadd float %sum, %tmp_9


 <State 17>: 8.59ns
ST_17: sum_1 (91)  [3/4] 8.59ns  loc: /home/sdsocuser/workspace/test/src/calcDist.cpp:28
:5  %sum_1 = fadd float %sum, %tmp_9


 <State 18>: 8.59ns
ST_18: sum_1 (91)  [2/4] 8.59ns  loc: /home/sdsocuser/workspace/test/src/calcDist.cpp:28
:5  %sum_1 = fadd float %sum, %tmp_9


 <State 19>: 8.59ns
ST_19: sum_1 (91)  [1/4] 8.59ns  loc: /home/sdsocuser/workspace/test/src/calcDist.cpp:28
:5  %sum_1 = fadd float %sum, %tmp_9

ST_19: StgValue_121 (92)  [1/1] 0.00ns  loc: /home/sdsocuser/workspace/test/src/calcDist.cpp:26
:6  br label %8


 <State 20>: 8.68ns
ST_20: tmp_6 (94)  [9/10] 8.68ns  loc: /home/sdsocuser/workspace/test/src/calcDist.cpp:30
:0  %tmp_6 = call float @llvm.sqrt.f32(float %sum)


 <State 21>: 8.68ns
ST_21: tmp_6 (94)  [8/10] 8.68ns  loc: /home/sdsocuser/workspace/test/src/calcDist.cpp:30
:0  %tmp_6 = call float @llvm.sqrt.f32(float %sum)


 <State 22>: 8.68ns
ST_22: tmp_6 (94)  [7/10] 8.68ns  loc: /home/sdsocuser/workspace/test/src/calcDist.cpp:30
:0  %tmp_6 = call float @llvm.sqrt.f32(float %sum)


 <State 23>: 8.68ns
ST_23: tmp_6 (94)  [6/10] 8.68ns  loc: /home/sdsocuser/workspace/test/src/calcDist.cpp:30
:0  %tmp_6 = call float @llvm.sqrt.f32(float %sum)


 <State 24>: 8.68ns
ST_24: tmp_6 (94)  [5/10] 8.68ns  loc: /home/sdsocuser/workspace/test/src/calcDist.cpp:30
:0  %tmp_6 = call float @llvm.sqrt.f32(float %sum)


 <State 25>: 8.68ns
ST_25: tmp_6 (94)  [4/10] 8.68ns  loc: /home/sdsocuser/workspace/test/src/calcDist.cpp:30
:0  %tmp_6 = call float @llvm.sqrt.f32(float %sum)


 <State 26>: 8.68ns
ST_26: tmp_6 (94)  [3/10] 8.68ns  loc: /home/sdsocuser/workspace/test/src/calcDist.cpp:30
:0  %tmp_6 = call float @llvm.sqrt.f32(float %sum)


 <State 27>: 8.68ns
ST_27: tmp_6 (94)  [2/10] 8.68ns  loc: /home/sdsocuser/workspace/test/src/calcDist.cpp:30
:0  %tmp_6 = call float @llvm.sqrt.f32(float %sum)


 <State 28>: 8.68ns
ST_28: tmp_6 (94)  [1/10] 8.68ns  loc: /home/sdsocuser/workspace/test/src/calcDist.cpp:30
:0  %tmp_6 = call float @llvm.sqrt.f32(float %sum)


 <State 29>: 2.38ns
ST_29: dists_hw_tmp_addr_1 (95)  [1/1] 0.00ns  loc: /home/sdsocuser/workspace/test/src/calcDist.cpp:30
:1  %dists_hw_tmp_addr_1 = getelementptr inbounds [1024 x float]* %dists_hw_tmp, i32 0, i32 %i2_cast3

ST_29: StgValue_132 (96)  [1/1] 2.38ns  loc: /home/sdsocuser/workspace/test/src/calcDist.cpp:30
:2  store float %tmp_6, float* %dists_hw_tmp_addr_1, align 4

ST_29: empty_9 (97)  [1/1] 0.00ns  loc: /home/sdsocuser/workspace/test/src/calcDist.cpp:31
:3  %empty_9 = call i32 (...)* @_ssdm_op_SpecRegionEnd([14 x i8]* @p_str4, i32 %tmp_2) nounwind

ST_29: StgValue_134 (98)  [1/1] 0.00ns  loc: /home/sdsocuser/workspace/test/src/calcDist.cpp:24
:4  br label %.preheader6


 <State 30>: 2.38ns
ST_30: i4 (102)  [1/1] 0.00ns
.preheader:0  %i4 = phi i11 [ %i_3, %11 ], [ 0, %.preheader.preheader ]

ST_30: i4_cast1 (103)  [1/1] 0.00ns  loc: /home/sdsocuser/workspace/test/src/calcDist.cpp:34
.preheader:1  %i4_cast1 = zext i11 %i4 to i32

ST_30: exitcond (104)  [1/1] 1.72ns  loc: /home/sdsocuser/workspace/test/src/calcDist.cpp:34
.preheader:2  %exitcond = icmp eq i11 %i4, -1024

ST_30: empty_10 (105)  [1/1] 0.00ns
.preheader:3  %empty_10 = call i32 (...)* @_ssdm_op_SpecLoopTripCount(i64 1024, i64 1024, i64 1024) nounwind

ST_30: i_3 (106)  [1/1] 1.50ns  loc: /home/sdsocuser/workspace/test/src/calcDist.cpp:34
.preheader:4  %i_3 = add i11 %i4, 1

ST_30: StgValue_140 (107)  [1/1] 0.00ns  loc: /home/sdsocuser/workspace/test/src/calcDist.cpp:34
.preheader:5  br i1 %exitcond, label %12, label %11

ST_30: dists_hw_tmp_addr (110)  [1/1] 0.00ns  loc: /home/sdsocuser/workspace/test/src/calcDist.cpp:35
:1  %dists_hw_tmp_addr = getelementptr inbounds [1024 x float]* %dists_hw_tmp, i32 0, i32 %i4_cast1

ST_30: dists_hw_tmp_load (111)  [2/2] 2.38ns  loc: /home/sdsocuser/workspace/test/src/calcDist.cpp:35
:2  %dists_hw_tmp_load = load float* %dists_hw_tmp_addr, align 4

ST_30: StgValue_143 (115)  [1/1] 0.00ns  loc: /home/sdsocuser/workspace/test/src/calcDist.cpp:37
:0  ret void


 <State 31>: 6.75ns
ST_31: StgValue_144 (109)  [1/1] 0.00ns  loc: /home/sdsocuser/workspace/test/src/calcDist.cpp:34
:0  call void (...)* @_ssdm_op_SpecLoopName([12 x i8]* @p_str5) nounwind

ST_31: dists_hw_tmp_load (111)  [1/2] 2.38ns  loc: /home/sdsocuser/workspace/test/src/calcDist.cpp:35
:2  %dists_hw_tmp_load = load float* %dists_hw_tmp_addr, align 4

ST_31: StgValue_146 (112)  [1/1] 4.38ns  loc: /home/sdsocuser/workspace/test/src/calcDist.cpp:35
:3  call void @_ssdm_op_Write.ap_fifo.floatP(float* %dists_hw, float %dists_hw_tmp_load) nounwind

ST_31: StgValue_147 (113)  [1/1] 0.00ns  loc: /home/sdsocuser/workspace/test/src/calcDist.cpp:34
:4  br label %.preheader



============================================================
+ Verbose Summary: Timing violations
============================================================
Target clock period: 10ns, clock uncertainty: 1.25ns.

 <State 1>: 1.31ns
The critical path consists of the following:
	multiplexor before 'phi' operation ('i') with incoming values : ('i', /home/sdsocuser/workspace/test/src/calcDist.cpp:12) [14]  (1.31 ns)

 <State 2>: 1.72ns
The critical path consists of the following:
	'phi' operation ('i') with incoming values : ('i', /home/sdsocuser/workspace/test/src/calcDist.cpp:12) [14]  (0 ns)
	'icmp' operation ('exitcond5', /home/sdsocuser/workspace/test/src/calcDist.cpp:12) [17]  (1.72 ns)

 <State 3>: 6.75ns
The critical path consists of the following:
	fifo read on port 'data_hw' (/home/sdsocuser/workspace/test/src/calcDist.cpp:14) [36]  (4.38 ns)
	'store' operation (/home/sdsocuser/workspace/test/src/calcDist.cpp:14) of variable 'data_hw_read', /home/sdsocuser/workspace/test/src/calcDist.cpp:14 on array 'data_hw_tmp', /home/sdsocuser/workspace/test/src/calcDist.cpp:7 [37]  (2.38 ns)

 <State 4>: 2.38ns
The critical path consists of the following:
	'phi' operation ('i') with incoming values : ('i', /home/sdsocuser/workspace/test/src/calcDist.cpp:19) [45]  (0 ns)
	'getelementptr' operation ('data_hw_tmp_addr', /home/sdsocuser/workspace/test/src/calcDist.cpp:20) [47]  (0 ns)
	'load' operation ('data_hw_tmp_load', /home/sdsocuser/workspace/test/src/calcDist.cpp:20) on array 'data_hw_tmp', /home/sdsocuser/workspace/test/src/calcDist.cpp:7 [54]  (2.38 ns)

 <State 5>: 4.76ns
The critical path consists of the following:
	'load' operation ('data_hw_tmp_load', /home/sdsocuser/workspace/test/src/calcDist.cpp:20) on array 'data_hw_tmp', /home/sdsocuser/workspace/test/src/calcDist.cpp:7 [54]  (2.38 ns)
	'store' operation (/home/sdsocuser/workspace/test/src/calcDist.cpp:20) of variable 'data_hw_tmp_load', /home/sdsocuser/workspace/test/src/calcDist.cpp:20 on array 'movie_tmp', /home/sdsocuser/workspace/test/src/calcDist.cpp:8 [56]  (2.38 ns)

 <State 6>: 1.72ns
The critical path consists of the following:
	'phi' operation ('i') with incoming values : ('i', /home/sdsocuser/workspace/test/src/calcDist.cpp:24) [61]  (0 ns)
	'icmp' operation ('exitcond2', /home/sdsocuser/workspace/test/src/calcDist.cpp:24) [65]  (1.72 ns)

 <State 7>: 8.68ns
The critical path consists of the following:
	'phi' operation ('sum') with incoming values : ('sum', /home/sdsocuser/workspace/test/src/calcDist.cpp:28) [74]  (0 ns)
	'fsqrt' operation ('tmp_6', /home/sdsocuser/workspace/test/src/calcDist.cpp:30) [94]  (8.68 ns)

 <State 8>: 2.38ns
The critical path consists of the following:
	'load' operation ('data_hw_tmp_load_1', /home/sdsocuser/workspace/test/src/calcDist.cpp:27) on array 'data_hw_tmp', /home/sdsocuser/workspace/test/src/calcDist.cpp:7 [86]  (2.38 ns)

 <State 9>: 8.59ns
The critical path consists of the following:
	'fsub' operation ('diff', /home/sdsocuser/workspace/test/src/calcDist.cpp:27) [89]  (8.59 ns)

 <State 10>: 8.59ns
The critical path consists of the following:
	'fsub' operation ('diff', /home/sdsocuser/workspace/test/src/calcDist.cpp:27) [89]  (8.59 ns)

 <State 11>: 8.59ns
The critical path consists of the following:
	'fsub' operation ('diff', /home/sdsocuser/workspace/test/src/calcDist.cpp:27) [89]  (8.59 ns)

 <State 12>: 8.59ns
The critical path consists of the following:
	'fsub' operation ('diff', /home/sdsocuser/workspace/test/src/calcDist.cpp:27) [89]  (8.59 ns)

 <State 13>: 8.43ns
The critical path consists of the following:
	'fmul' operation ('tmp_9', /home/sdsocuser/workspace/test/src/calcDist.cpp:28) [90]  (8.43 ns)

 <State 14>: 8.43ns
The critical path consists of the following:
	'fmul' operation ('tmp_9', /home/sdsocuser/workspace/test/src/calcDist.cpp:28) [90]  (8.43 ns)

 <State 15>: 8.43ns
The critical path consists of the following:
	'fmul' operation ('tmp_9', /home/sdsocuser/workspace/test/src/calcDist.cpp:28) [90]  (8.43 ns)

 <State 16>: 8.59ns
The critical path consists of the following:
	'fadd' operation ('sum', /home/sdsocuser/workspace/test/src/calcDist.cpp:28) [91]  (8.59 ns)

 <State 17>: 8.59ns
The critical path consists of the following:
	'fadd' operation ('sum', /home/sdsocuser/workspace/test/src/calcDist.cpp:28) [91]  (8.59 ns)

 <State 18>: 8.59ns
The critical path consists of the following:
	'fadd' operation ('sum', /home/sdsocuser/workspace/test/src/calcDist.cpp:28) [91]  (8.59 ns)

 <State 19>: 8.59ns
The critical path consists of the following:
	'fadd' operation ('sum', /home/sdsocuser/workspace/test/src/calcDist.cpp:28) [91]  (8.59 ns)

 <State 20>: 8.68ns
The critical path consists of the following:
	'fsqrt' operation ('tmp_6', /home/sdsocuser/workspace/test/src/calcDist.cpp:30) [94]  (8.68 ns)

 <State 21>: 8.68ns
The critical path consists of the following:
	'fsqrt' operation ('tmp_6', /home/sdsocuser/workspace/test/src/calcDist.cpp:30) [94]  (8.68 ns)

 <State 22>: 8.68ns
The critical path consists of the following:
	'fsqrt' operation ('tmp_6', /home/sdsocuser/workspace/test/src/calcDist.cpp:30) [94]  (8.68 ns)

 <State 23>: 8.68ns
The critical path consists of the following:
	'fsqrt' operation ('tmp_6', /home/sdsocuser/workspace/test/src/calcDist.cpp:30) [94]  (8.68 ns)

 <State 24>: 8.68ns
The critical path consists of the following:
	'fsqrt' operation ('tmp_6', /home/sdsocuser/workspace/test/src/calcDist.cpp:30) [94]  (8.68 ns)

 <State 25>: 8.68ns
The critical path consists of the following:
	'fsqrt' operation ('tmp_6', /home/sdsocuser/workspace/test/src/calcDist.cpp:30) [94]  (8.68 ns)

 <State 26>: 8.68ns
The critical path consists of the following:
	'fsqrt' operation ('tmp_6', /home/sdsocuser/workspace/test/src/calcDist.cpp:30) [94]  (8.68 ns)

 <State 27>: 8.68ns
The critical path consists of the following:
	'fsqrt' operation ('tmp_6', /home/sdsocuser/workspace/test/src/calcDist.cpp:30) [94]  (8.68 ns)

 <State 28>: 8.68ns
The critical path consists of the following:
	'fsqrt' operation ('tmp_6', /home/sdsocuser/workspace/test/src/calcDist.cpp:30) [94]  (8.68 ns)

 <State 29>: 2.38ns
The critical path consists of the following:
	'getelementptr' operation ('dists_hw_tmp_addr_1', /home/sdsocuser/workspace/test/src/calcDist.cpp:30) [95]  (0 ns)
	'store' operation (/home/sdsocuser/workspace/test/src/calcDist.cpp:30) of variable 'tmp_6', /home/sdsocuser/workspace/test/src/calcDist.cpp:30 on array 'dists_hw_tmp', /home/sdsocuser/workspace/test/src/calcDist.cpp:9 [96]  (2.38 ns)

 <State 30>: 2.38ns
The critical path consists of the following:
	'phi' operation ('i') with incoming values : ('i', /home/sdsocuser/workspace/test/src/calcDist.cpp:34) [102]  (0 ns)
	'getelementptr' operation ('dists_hw_tmp_addr', /home/sdsocuser/workspace/test/src/calcDist.cpp:35) [110]  (0 ns)
	'load' operation ('dists_hw_tmp_load', /home/sdsocuser/workspace/test/src/calcDist.cpp:35) on array 'dists_hw_tmp', /home/sdsocuser/workspace/test/src/calcDist.cpp:9 [111]  (2.38 ns)

 <State 31>: 6.75ns
The critical path consists of the following:
	'load' operation ('dists_hw_tmp_load', /home/sdsocuser/workspace/test/src/calcDist.cpp:35) on array 'dists_hw_tmp', /home/sdsocuser/workspace/test/src/calcDist.cpp:9 [111]  (2.38 ns)
	fifo write on port 'dists_hw' (/home/sdsocuser/workspace/test/src/calcDist.cpp:35) [112]  (4.38 ns)


============================================================
+ Verbose Summary: Binding
============================================================
N/A
* FSMD analyzer results:
  - Output states:
 - Input state : 
  - Chain level:
	State 1
	State 2
	State 3
	State 4
	State 5
	State 6
	State 7
	State 8
	State 9
	State 10
	State 11
	State 12
	State 13
	State 14
	State 15
	State 16
	State 17
	State 18
	State 19
	State 20
	State 21
	State 22
	State 23
	State 24
	State 25
	State 26
	State 27
	State 28
	State 29
	State 30
	State 31


============================================================
+ Verbose Summary: Datapath Resource usage 
============================================================
N/A
